{
  "allowed_disagreements": [],
  "case_id": "CASE-ZIWEI-NATAL-056",
  "category": "standard",
  "data_classification": "synthetic",
  "expected_intermediate": {
    "five_elements_class": "火六局",
    "star_placements": {
      "auxiliaryStars:三台": 5,
      "auxiliaryStars:丧门": 2,
      "auxiliaryStars:临官": 9,
      "auxiliaryStars:亡神": 3,
      "auxiliaryStars:伏兵": 8,
      "auxiliaryStars:八座": 5,
      "auxiliaryStars:养": 1,
      "auxiliaryStars:冠带": 10,
      "auxiliaryStars:凤阁": 6,
      "auxiliaryStars:力士": 5,
      "auxiliaryStars:劫煞": 9,
      "auxiliaryStars:华盖": 8,
      "auxiliaryStars:博士": 6,
      "auxiliaryStars:台辅": 7,
      "auxiliaryStars:吊客": 10,
      "auxiliaryStars:咸池": 1,
      "auxiliaryStars:喜神": 11,
      "auxiliaryStars:地劫": 0,
      "auxiliaryStars:地空": 6,
      "auxiliaryStars:墓": 4,
      "auxiliaryStars:大耗": 9,
      "auxiliaryStars:天伤": 3,
      "auxiliaryStars:天使": 5,
      "auxiliaryStars:天刑": 8,
      "auxiliaryStars:天哭": 2,
      "auxiliaryStars:天喜": 5,
      "auxiliaryStars:天姚": 0,
      "auxiliaryStars:天德": 9,
      "auxiliaryStars:天煞": 11,
      "auxiliaryStars:天虚": 6,
      "auxiliaryStars:天钺": 5,
      "auxiliaryStars:天马": 6,
      "auxiliaryStars:天魁": 11,
      "auxiliaryStars:奏书": 1,
      "auxiliaryStars:官府": 7,
      "auxiliaryStars:官符": 4,
      "auxiliaryStars:封诰": 3,
      "auxiliaryStars:将军": 2,
      "auxiliaryStars:将星": 4,
      "auxiliaryStars:小耗": 5,
      "auxiliaryStars:岁建": 0,
      "auxiliaryStars:岁驿": 6,
      "auxiliaryStars:帝旺": 8,
      "auxiliaryStars:年解": 6,
      "auxiliaryStars:息神": 7,
      "auxiliaryStars:指背": 0,
      "auxiliaryStars:擎羊": 7,
      "auxiliaryStars:攀鞍": 5,
      "auxiliaryStars:晦气": 1,
      "auxiliaryStars:月德": 5,
      "auxiliaryStars:月煞": 2,
      "auxiliaryStars:死": 5,
      "auxiliaryStars:沐浴": 11,
      "auxiliaryStars:火星": 2,
      "auxiliaryStars:灾煞": 10,
      "auxiliaryStars:病": 6,
      "auxiliaryStars:病符": 11,
      "auxiliaryStars:白虎": 8,
      "auxiliaryStars:禄存": 6,
      "auxiliaryStars:红鸾": 11,
      "auxiliaryStars:绝": 3,
      "auxiliaryStars:胎": 2,
      "auxiliaryStars:衰": 7,
      "auxiliaryStars:解神": 6,
      "auxiliaryStars:贯索": 3,
      "auxiliaryStars:铃星": 4,
      "auxiliaryStars:长生": 0,
      "auxiliaryStars:陀罗": 5,
      "auxiliaryStars:青龙": 4,
      "auxiliaryStars:飞廉": 0,
      "auxiliaryStars:龙德": 7,
      "auxiliaryStars:龙池": 4,
      "majorStars:七杀": 7,
      "majorStars:天同": 6,
      "majorStars:天府": 1,
      "majorStars:天机": 10,
      "majorStars:天梁": 6,
      "majorStars:天相": 5,
      "majorStars:太阳": 8,
      "majorStars:太阴": 2,
      "majorStars:巨门": 4,
      "majorStars:廉贞": 3,
      "majorStars:武曲": 7,
      "majorStars:破军": 11,
      "majorStars:紫微": 11,
      "majorStars:贪狼": 3,
      "minorStars:右弼": 7,
      "minorStars:左辅": 3,
      "minorStars:文昌": 5,
      "minorStars:文曲": 5
    },
    "time_index": 3
  },
  "expected_output": {
    "computed_facts_sha256": "f657c5b1c28955481c80c6cfe3d5f80f5f4021958fcbe8f1404b60162776c1a5",
    "palace_count": 12
  },
  "forbidden_conclusions": [
    "A fixed life event is guaranteed.",
    "The calculation-gender parameter was inferred as identity.",
    "A brightness value was invented."
  ],
  "lineage": "project-native-ziwei-structural-v0.4",
  "must_match_rules": [
    "ZIWEI-NATIVE-NATAL-001",
    "ZIWEI-TIME-INDEX-001",
    "ZIWEI-STAR-AUX-001",
    "ZIWEI-CYCLE-DECADAL-001",
    "ZIWEI-STRUCTURAL-BOUNDARY-001"
  ],
  "normalized_input": {
    "calculation_gender": "female",
    "calendar_leap_month": false,
    "calendar_type": "solar",
    "effective_lunar_month": 2,
    "fold": 0,
    "late_zi_policy": "current_day",
    "leap_month_policy": "preserve",
    "lineage": "project-native-ziwei-structural-v0.4",
    "local_datetime": "2010-03-30T05:17:00-04:00",
    "time_index": 3,
    "timezone": "America/New_York",
    "utc_datetime": "2010-03-30T09:17:00Z",
    "year_boundary": "lunar_new_year"
  },
  "raw_input": {
    "calculation_gender": "female",
    "local_datetime": "2010-03-30T05:17:00",
    "timezone": "America/New_York"
  },
  "reviewers": [
    {
      "decision": "accepted",
      "notes": "Synthetic deterministic regression review; independent Ziwei expert acceptance remains pending.",
      "reviewed_at": "2026-07-23",
      "reviewer_id": "project-native-regression-review",
      "role": "calculation"
    }
  ],
  "sources": [
    {
      "locator": "project-native structural calculation v0.4",
      "source_id": "SRC-ZIWEI-PROJECT-SPEC-001"
    },
    {
      "locator": "formula sections for palaces, stars, cycles, and limits",
      "source_id": "SRC-ZIWEI-QUANSHU-001"
    }
  ],
  "system": "ziwei",
  "title": "Project-native Ziwei structural chart 056"
}
