{
  "allowed_disagreements": [],
  "case_id": "CASE-ZIWEI-EDGE-BOUNDARY-024",
  "category": "edge_case",
  "data_classification": "synthetic",
  "expected_intermediate": {
    "five_elements_class": "木三局",
    "star_placements": {
      "auxiliaryStars:三台": 8,
      "auxiliaryStars:丧门": 5,
      "auxiliaryStars:临官": 0,
      "auxiliaryStars:亡神": 6,
      "auxiliaryStars:伏兵": 5,
      "auxiliaryStars:八座": 2,
      "auxiliaryStars:养": 8,
      "auxiliaryStars:冠带": 11,
      "auxiliaryStars:凤阁": 3,
      "auxiliaryStars:力士": 8,
      "auxiliaryStars:劫煞": 0,
      "auxiliaryStars:华盖": 11,
      "auxiliaryStars:博士": 7,
      "auxiliaryStars:台辅": 4,
      "auxiliaryStars:吊客": 1,
      "auxiliaryStars:咸池": 4,
      "auxiliaryStars:喜神": 2,
      "auxiliaryStars:地劫": 9,
      "auxiliaryStars:地空": 9,
      "auxiliaryStars:墓": 5,
      "auxiliaryStars:大耗": 9,
      "auxiliaryStars:天伤": 6,
      "auxiliaryStars:天使": 8,
      "auxiliaryStars:天刑": 8,
      "auxiliaryStars:天哭": 11,
      "auxiliaryStars:天喜": 2,
      "auxiliaryStars:天姚": 0,
      "auxiliaryStars:天德": 0,
      "auxiliaryStars:天煞": 2,
      "auxiliaryStars:天虚": 9,
      "auxiliaryStars:天钺": 0,
      "auxiliaryStars:天马": 9,
      "auxiliaryStars:天魁": 4,
      "auxiliaryStars:奏书": 0,
      "auxiliaryStars:官府": 6,
      "auxiliaryStars:官符": 7,
      "auxiliaryStars:封诰": 0,
      "auxiliaryStars:将军": 11,
      "auxiliaryStars:将星": 7,
      "auxiliaryStars:小耗": 10,
      "auxiliaryStars:岁建": 3,
      "auxiliaryStars:岁驿": 9,
      "auxiliaryStars:帝旺": 1,
      "auxiliaryStars:年解": 3,
      "auxiliaryStars:息神": 10,
      "auxiliaryStars:指背": 3,
      "auxiliaryStars:擎羊": 8,
      "auxiliaryStars:攀鞍": 8,
      "auxiliaryStars:晦气": 4,
      "auxiliaryStars:月德": 8,
      "auxiliaryStars:月煞": 5,
      "auxiliaryStars:死": 4,
      "auxiliaryStars:沐浴": 10,
      "auxiliaryStars:火星": 1,
      "auxiliaryStars:灾煞": 1,
      "auxiliaryStars:病": 3,
      "auxiliaryStars:病符": 3,
      "auxiliaryStars:白虎": 11,
      "auxiliaryStars:禄存": 7,
      "auxiliaryStars:红鸾": 8,
      "auxiliaryStars:绝": 6,
      "auxiliaryStars:胎": 7,
      "auxiliaryStars:衰": 2,
      "auxiliaryStars:解神": 6,
      "auxiliaryStars:贯索": 6,
      "auxiliaryStars:铃星": 8,
      "auxiliaryStars:长生": 9,
      "auxiliaryStars:陀罗": 6,
      "auxiliaryStars:青龙": 9,
      "auxiliaryStars:飞廉": 1,
      "auxiliaryStars:龙德": 10,
      "auxiliaryStars:龙池": 7,
      "majorStars:七杀": 5,
      "majorStars:天同": 8,
      "majorStars:天府": 11,
      "majorStars:天机": 0,
      "majorStars:天梁": 4,
      "majorStars:天相": 3,
      "majorStars:太阳": 10,
      "majorStars:太阴": 0,
      "majorStars:巨门": 2,
      "majorStars:廉贞": 5,
      "majorStars:武曲": 9,
      "majorStars:破军": 9,
      "majorStars:紫微": 1,
      "majorStars:贪狼": 1,
      "minorStars:右弼": 7,
      "minorStars:左辅": 3,
      "minorStars:文昌": 8,
      "minorStars:文曲": 2
    },
    "time_index": 12
  },
  "expected_output": {
    "computed_facts_sha256": "c16e2e67eac0a97ef7706954b0282be30dc8cfc1d365e5292bf33c6d9b25883b",
    "palace_count": 12
  },
  "forbidden_conclusions": [
    "A fixed life event is guaranteed.",
    "The calculation-gender parameter was inferred as identity.",
    "A brightness value outside the selected classical matrix was invented."
  ],
  "lineage": "project-native-ziwei-structural-v0.5",
  "must_match_rules": [
    "ZIWEI-INPUT-POLICY-001",
    "ZIWEI-TIME-INDEX-001",
    "ZIWEI-STRUCTURAL-BOUNDARY-001"
  ],
  "normalized_input": {
    "calculation_datetime": "2061-02-24T23:59:00+08:00",
    "calculation_gender": "female",
    "calendar_leap_month": false,
    "calendar_type": "solar",
    "effective_lunar_month": 2,
    "fold": 0,
    "late_zi_policy": "next_day",
    "latitude": null,
    "leap_month_policy": "preserve",
    "lineage": "project-native-ziwei-structural-v0.5",
    "local_datetime": "2061-02-24T23:59:00+08:00",
    "longitude": null,
    "solar_time_correction": null,
    "time_basis": "civil",
    "time_index": 12,
    "timezone": "Asia/Shanghai",
    "true_solar_time_applied": false,
    "utc_datetime": "2061-02-24T15:59:00Z",
    "year_boundary": "lunar_new_year"
  },
  "raw_input": {
    "calculation_gender": "female",
    "late_zi_policy": "next_day",
    "leap_month_policy": "preserve",
    "local_datetime": "2061-02-24T23:59:00",
    "timezone": "Asia/Shanghai",
    "year_boundary": "lunar_new_year"
  },
  "reviewers": [
    {
      "decision": "accepted",
      "notes": "Synthetic deterministic regression review; independent Ziwei expert acceptance remains pending.",
      "reviewed_at": "2026-07-23",
      "reviewer_id": "project-native-regression-review",
      "role": "calculation"
    }
  ],
  "sources": [
    {
      "locator": "project-native structural calculation v0.5",
      "source_id": "SRC-ZIWEI-PROJECT-SPEC-001"
    },
    {
      "locator": "formula sections for palaces, stars, cycles, and limits",
      "source_id": "SRC-ZIWEI-QUANSHU-001"
    }
  ],
  "system": "ziwei",
  "title": "Ziwei boundary policy case 024"
}
