{
  "allowed_disagreements": [],
  "case_id": "CASE-BAZI-EDGE-TERM-1986-LIXIA-BEFORE-015",
  "category": "edge_case",
  "data_classification": "synthetic",
  "expected_intermediate": {},
  "expected_output": {
    "computed_facts": {
      "pillars": {
        "day": "庚戌",
        "hour": "戊寅",
        "month": "壬辰",
        "year": "丙寅"
      }
    }
  },
  "forbidden_conclusions": [
    "A fixed life event is guaranteed.",
    "An unsupported true-solar-time correction was silently applied."
  ],
  "lineage": "ziping-calculation-baseline",
  "must_match_rules": [
    "BAZI-CAL-YEAR-001",
    "BAZI-CAL-MONTH-001"
  ],
  "normalized_input": {
    "day_boundary": "midnight",
    "timezone": "Asia/Shanghai"
  },
  "raw_input": {
    "local_datetime": "1986-05-06T04:30:35",
    "timezone": "Asia/Shanghai"
  },
  "reviewers": [
    {
      "decision": "accepted",
      "notes": "Synthetic development case checked against pinned APIs; not expert interpretation review.",
      "reviewed_at": "2026-07-23",
      "reviewer_id": "pinned-comparator-review",
      "role": "calculation"
    }
  ],
  "sources": [
    {
      "locator": "EightChar API v1.4.8",
      "source_id": "SRC-BAZI-LUNARPY-001"
    },
    {
      "locator": "24 solar terms longitude table and 2024 calendar",
      "source_id": "SRC-ASTRONOMY-HKO-SOLAR-TERMS-001"
    }
  ],
  "system": "bazi",
  "title": "before 1986 立夏 exact boundary"
}
