{
  "allowed_disagreements": [],
  "case_id": "CASE-ZIWEI-NATAL-022",
  "category": "standard",
  "data_classification": "synthetic",
  "expected_intermediate": {
    "five_elements_class": "水二局",
    "star_placements": {
      "auxiliaryStars:三台": 11,
      "auxiliaryStars:丧门": 6,
      "auxiliaryStars:临官": 3,
      "auxiliaryStars:亡神": 3,
      "auxiliaryStars:伏兵": 11,
      "auxiliaryStars:八座": 11,
      "auxiliaryStars:养": 7,
      "auxiliaryStars:冠带": 4,
      "auxiliaryStars:凤阁": 2,
      "auxiliaryStars:力士": 8,
      "auxiliaryStars:劫煞": 9,
      "auxiliaryStars:华盖": 8,
      "auxiliaryStars:博士": 9,
      "auxiliaryStars:台辅": 0,
      "auxiliaryStars:吊客": 2,
      "auxiliaryStars:咸池": 1,
      "auxiliaryStars:喜神": 2,
      "auxiliaryStars:地劫": 5,
      "auxiliaryStars:地空": 1,
      "auxiliaryStars:墓": 10,
      "auxiliaryStars:大耗": 11,
      "auxiliaryStars:天伤": 9,
      "auxiliaryStars:天使": 11,
      "auxiliaryStars:天刑": 7,
      "auxiliaryStars:天厨": 7,
      "auxiliaryStars:天哭": 10,
      "auxiliaryStars:天喜": 1,
      "auxiliaryStars:天姚": 11,
      "auxiliaryStars:天官": 8,
      "auxiliaryStars:天寿": 2,
      "auxiliaryStars:天巫": 3,
      "auxiliaryStars:天德": 1,
      "auxiliaryStars:天才": 10,
      "auxiliaryStars:天月": 8,
      "auxiliaryStars:天煞": 11,
      "auxiliaryStars:天福": 4,
      "auxiliaryStars:天空": 5,
      "auxiliaryStars:天虚": 10,
      "auxiliaryStars:天贵": 6,
      "auxiliaryStars:天钺": 3,
      "auxiliaryStars:天马": 6,
      "auxiliaryStars:天魁": 1,
      "auxiliaryStars:奏书": 4,
      "auxiliaryStars:孤辰": 6,
      "auxiliaryStars:官府": 10,
      "auxiliaryStars:官符": 8,
      "auxiliaryStars:寡宿": 2,
      "auxiliaryStars:封诰": 8,
      "auxiliaryStars:将军": 5,
      "auxiliaryStars:将星": 4,
      "auxiliaryStars:小耗": 9,
      "auxiliaryStars:岁建": 4,
      "auxiliaryStars:岁驿": 6,
      "auxiliaryStars:帝旺": 2,
      "auxiliaryStars:年解": 2,
      "auxiliaryStars:恩光": 8,
      "auxiliaryStars:息神": 7,
      "auxiliaryStars:截空": 0,
      "auxiliaryStars:指背": 0,
      "auxiliaryStars:擎羊": 10,
      "auxiliaryStars:攀鞍": 5,
      "auxiliaryStars:旬空": 6,
      "auxiliaryStars:晦气": 5,
      "auxiliaryStars:月德": 9,
      "auxiliaryStars:月煞": 2,
      "auxiliaryStars:死": 11,
      "auxiliaryStars:沐浴": 5,
      "auxiliaryStars:火星": 7,
      "auxiliaryStars:灾煞": 10,
      "auxiliaryStars:病": 0,
      "auxiliaryStars:病符": 3,
      "auxiliaryStars:白虎": 0,
      "auxiliaryStars:破碎": 3,
      "auxiliaryStars:禄存": 9,
      "auxiliaryStars:红鸾": 7,
      "auxiliaryStars:绝": 9,
      "auxiliaryStars:胎": 8,
      "auxiliaryStars:蜚廉": 0,
      "auxiliaryStars:衰": 1,
      "auxiliaryStars:解神": 6,
      "auxiliaryStars:贯索": 7,
      "auxiliaryStars:铃星": 9,
      "auxiliaryStars:长生": 6,
      "auxiliaryStars:阴煞": 0,
      "auxiliaryStars:陀罗": 8,
      "auxiliaryStars:青龙": 7,
      "auxiliaryStars:飞廉": 3,
      "auxiliaryStars:龙德": 11,
      "auxiliaryStars:龙池": 8,
      "majorStars:七杀": 8,
      "majorStars:天同": 5,
      "majorStars:天府": 2,
      "majorStars:天机": 9,
      "majorStars:天梁": 7,
      "majorStars:天相": 6,
      "majorStars:太阳": 7,
      "majorStars:太阴": 3,
      "majorStars:巨门": 5,
      "majorStars:廉贞": 2,
      "majorStars:武曲": 6,
      "majorStars:破军": 0,
      "majorStars:紫微": 10,
      "majorStars:贪狼": 4,
      "minorStars:右弼": 8,
      "minorStars:左辅": 2,
      "minorStars:文昌": 0,
      "minorStars:文曲": 10
    },
    "time_index": 8
  },
  "expected_output": {
    "computed_facts_sha256": "502e1705a9ef1be359d37bcb37fc65139f6ea49472df38c9a04cd7d79c2c8c8a",
    "palace_count": 12
  },
  "forbidden_conclusions": [
    "A fixed life event is guaranteed.",
    "The calculation-gender parameter was inferred as identity.",
    "A brightness value outside the selected classical matrix was invented."
  ],
  "lineage": "project-native-ziwei-structural-v0.5",
  "must_match_rules": [
    "ZIWEI-NATIVE-NATAL-001",
    "ZIWEI-TIME-INDEX-001",
    "ZIWEI-STAR-AUX-001",
    "ZIWEI-STAR-BRIGHTNESS-001",
    "ZIWEI-CYCLE-DECADAL-001",
    "ZIWEI-STRUCTURAL-BOUNDARY-001"
  ],
  "normalized_input": {
    "calculation_datetime": "1942-03-08T15:17:00+00:00",
    "calculation_gender": "female",
    "calendar_leap_month": false,
    "calendar_type": "solar",
    "effective_lunar_month": 1,
    "fold": 0,
    "late_zi_policy": "current_day",
    "latitude": null,
    "leap_month_policy": "preserve",
    "lineage": "project-native-ziwei-structural-v0.5",
    "local_datetime": "1942-03-08T15:17:00+00:00",
    "longitude": null,
    "solar_time_correction": null,
    "time_basis": "civil",
    "time_index": 8,
    "timezone": "UTC",
    "true_solar_time_applied": false,
    "utc_datetime": "1942-03-08T15:17:00Z",
    "year_boundary": "lunar_new_year"
  },
  "raw_input": {
    "calculation_gender": "female",
    "local_datetime": "1942-03-08T15:17:00",
    "timezone": "UTC"
  },
  "reviewers": [
    {
      "decision": "accepted",
      "notes": "Synthetic deterministic regression review; independent Ziwei expert acceptance remains pending.",
      "reviewed_at": "2026-07-23",
      "reviewer_id": "project-native-regression-review",
      "role": "calculation"
    }
  ],
  "sources": [
    {
      "locator": "project-native structural calculation v0.5",
      "source_id": "SRC-ZIWEI-PROJECT-SPEC-001"
    },
    {
      "locator": "formula sections for palaces, stars, cycles, and limits",
      "source_id": "SRC-ZIWEI-QUANSHU-001"
    }
  ],
  "system": "ziwei",
  "title": "Project-native Ziwei structural chart 022"
}
