{
  "allowed_disagreements": [],
  "case_id": "CASE-RUNES-DRAW-005",
  "category": "standard",
  "data_classification": "synthetic",
  "expected_intermediate": {
    "deck_sha256": "ed73b18306915b677afd1f6501230ed8a1918fe15a00cc9d84484e04fcff9497"
  },
  "expected_output": {
    "audit": {
      "draw_id": "3eaec7fd572b86d8f9bb8b053ee6891ec6c2f8df92e9abbbc56605d03206ea65"
    },
    "computed_facts": {
      "spread": "single",
      "symbols": [
        {
          "fact_id": "runes.draw.symbol.001",
          "name": "Sowilo",
          "orientation": "upright",
          "position": "focus",
          "source_ids": [
            "SRC-RUNES-PROJECT-SPEC-001"
          ],
          "symbol_id": "runes.16.sowilo",
          "symbol_index": 15
        }
      ]
    }
  },
  "forbidden_conclusions": [
    "A fixed future event is guaranteed.",
    "The symbols establish a hidden fact about a third party."
  ],
  "lineage": "elder-futhark-project-v0.1",
  "must_match_rules": [
    "RUNES-SYMBOL-UPRIGHT-001",
    "RUNES-POSITION-001",
    "RUNES-SEQUENCE-001"
  ],
  "normalized_input": {
    "allow_reversals": false,
    "lineage": "elder-futhark-project-v0.1",
    "question_sha256": "c0ec7e406072af9c51f86744ccd95b8a2bcf617238a9b8f331a4cd4f97f0de7a",
    "spread": "single"
  },
  "raw_input": {
    "allow_reversals": false,
    "question": "Synthetic rune reflection prompt 5",
    "seed_hex": "0000000000000000000000000000000000000000000000000000000000000069",
    "spread": "single"
  },
  "reviewers": [
    {
      "decision": "accepted",
      "notes": "Synthetic replay review; not evidence of predictive validity.",
      "reviewed_at": "2026-07-23",
      "reviewer_id": "deterministic-draw-review",
      "role": "calculation"
    }
  ],
  "sources": [
    {
      "locator": "text-only 24-symbol project deck and draw contract",
      "source_id": "SRC-RUNES-PROJECT-SPEC-001"
    }
  ],
  "system": "runes",
  "title": "Auditable Elder Futhark draw 005"
}
