{
  "allowed_disagreements": [],
  "case_id": "CASE-TAROT-DRAW-008",
  "category": "standard",
  "data_classification": "synthetic",
  "expected_intermediate": {
    "deck_sha256": "5e2d1b53933bb3c3faadd77ea255c1779c30e8d13da7839fffb02d74d98821a2"
  },
  "expected_output": {
    "audit": {
      "draw_id": "0b561873de4f791ea296221cbb951ba498d2f09601f52b5143ba567833dea0a9"
    },
    "computed_facts": {
      "cards": [
        {
          "arcana": "minor",
          "card_id": "tarot.rws.swords-king",
          "card_index": 63,
          "deck_index": 63,
          "element": "air",
          "fact_id": "tarot.draw.card.001",
          "identity_lineage": "rws-identity-v0.3",
          "name": "King of Swords",
          "orientation": "upright",
          "position": "situation",
          "rank": "king",
          "source_ids": [
            "SRC-TAROT-DECK-SPEC-001",
            "SRC-TAROT-WAITE-WIKISOURCE-001"
          ],
          "suit": "swords"
        },
        {
          "arcana": "minor",
          "card_id": "tarot.rws.swords-three",
          "card_index": 52,
          "deck_index": 52,
          "element": "air",
          "fact_id": "tarot.draw.card.002",
          "identity_lineage": "rws-identity-v0.3",
          "name": "Three of Swords",
          "orientation": "upright",
          "position": "challenge",
          "rank": "three",
          "source_ids": [
            "SRC-TAROT-DECK-SPEC-001",
            "SRC-TAROT-WAITE-WIKISOURCE-001"
          ],
          "suit": "swords"
        },
        {
          "arcana": "minor",
          "card_id": "tarot.rws.swords-two",
          "card_index": 51,
          "deck_index": 51,
          "element": "air",
          "fact_id": "tarot.draw.card.003",
          "identity_lineage": "rws-identity-v0.3",
          "name": "Two of Swords",
          "orientation": "upright",
          "position": "guidance",
          "rank": "two",
          "source_ids": [
            "SRC-TAROT-DECK-SPEC-001",
            "SRC-TAROT-WAITE-WIKISOURCE-001"
          ],
          "suit": "swords"
        }
      ],
      "spread": "situation-challenge-guidance"
    }
  },
  "forbidden_conclusions": [
    "A fixed future event is guaranteed.",
    "The cards establish a hidden fact about a third party."
  ],
  "lineage": "rws-identity-v0.3",
  "must_match_rules": [
    "TAROT-DRAW-UNIQUE-001",
    "TAROT-POSITION-001",
    "TAROT-NARRATIVE-001",
    "TAROT-CARD-IDENTITY-001",
    "TAROT-ORIENTATION-UPRIGHT-001"
  ],
  "normalized_input": {
    "allow_reversals": false,
    "question_sha256": "e96a6755f8d61750f189b76236d67205f9888437bdf9e0f427e966c12f11f3a4",
    "spread": "situation-challenge-guidance"
  },
  "raw_input": {
    "allow_reversals": false,
    "question": "Synthetic reflection prompt 8",
    "seed_hex": "0000000000000000000000000000000000000000000000000000000000000008",
    "spread": "situation-challenge-guidance"
  },
  "reviewers": [
    {
      "decision": "accepted",
      "notes": "Synthetic deterministic regression case; not proof of predictive validity.",
      "reviewed_at": "2026-07-23",
      "reviewer_id": "deterministic-draw-review",
      "role": "calculation"
    }
  ],
  "sources": [
    {
      "locator": "rws-78.json and auditable draw contract",
      "source_id": "SRC-TAROT-DECK-SPEC-001"
    },
    {
      "locator": "The Pictorial Key to the Tarot",
      "source_id": "SRC-TAROT-WAITE-WIKISOURCE-001"
    }
  ],
  "system": "tarot",
  "title": "Auditable Tarot draw 008"
}
