{
  "allowed_disagreements": [
    {
      "allowed_values": [
        "甲申",
        "乙酉"
      ],
      "dispute_id": "DSP-BAZI-MONTH-BOUNDARY-001",
      "field_path": "computed_facts.month_pillar"
    }
  ],
  "case_id": "CASE-BAZI-DISPUTE-MONTH-BOUNDARY-002",
  "category": "dispute",
  "data_classification": "synthetic",
  "expected_intermediate": {},
  "expected_output": {
    "computed_facts": {
      "month_pillar": "甲申"
    }
  },
  "forbidden_conclusions": [
    "A fixed life event is guaranteed.",
    "An unsupported true-solar-time correction was silently applied."
  ],
  "lineage": "ziping-calculation-baseline",
  "must_match_rules": [
    "BAZI-CAL-MONTH-001",
    "BAZI-CAL-MONTH-002"
  ],
  "normalized_input": {
    "day_boundary": "midnight",
    "timezone": "Asia/Shanghai"
  },
  "raw_input": {
    "local_datetime": "2000-09-07T08:00:00",
    "timezone": "Asia/Shanghai"
  },
  "reviewers": [
    {
      "decision": "accepted",
      "notes": "Synthetic development case checked against pinned APIs; not expert interpretation review.",
      "reviewed_at": "2026-07-23",
      "reviewer_id": "pinned-comparator-review",
      "role": "calculation"
    }
  ],
  "sources": [
    {
      "locator": "EightChar API v1.4.8",
      "source_id": "SRC-BAZI-LUNARPY-001"
    }
  ],
  "system": "bazi",
  "title": "Exact-instant versus whole-day month boundary"
}
