{
  "allowed_disagreements": [],
  "case_id": "CASE-BAZI-EDGE-STJOHNS-1988-030",
  "category": "edge_case",
  "data_classification": "synthetic",
  "expected_intermediate": {},
  "expected_output": {
    "computed_facts": {
      "pillars": {
        "day": "丁巳",
        "hour": "丙午",
        "month": "戊午",
        "year": "戊辰"
      }
    }
  },
  "forbidden_conclusions": [
    "A fixed life event is guaranteed.",
    "An unsupported true-solar-time correction was silently applied."
  ],
  "lineage": "ziping-calculation-baseline",
  "must_match_rules": [
    "BAZI-TIME-CIVIL-001",
    "BAZI-CAL-DAY-001"
  ],
  "normalized_input": {
    "day_boundary": "midnight",
    "timezone": "America/St_Johns"
  },
  "raw_input": {
    "local_datetime": "1988-07-01T12:00:00",
    "timezone": "America/St_Johns"
  },
  "reviewers": [
    {
      "decision": "accepted",
      "notes": "Synthetic development case checked against pinned APIs; not expert interpretation review.",
      "reviewed_at": "2026-07-23",
      "reviewer_id": "pinned-comparator-review",
      "role": "calculation"
    }
  ],
  "sources": [
    {
      "locator": "ZoneInfo fold and transition behavior",
      "source_id": "SRC-TIME-PYTHON-ZONEINFO-001"
    },
    {
      "locator": "EightChar API v1.4.8",
      "source_id": "SRC-BAZI-LUNARPY-001"
    }
  ],
  "system": "bazi",
  "title": "Historical or calendar boundary case in America/St_Johns"
}
