{
  "allowed_disagreements": [],
  "case_id": "CASE-NUMEROLOGY-PROFILE-002",
  "category": "standard",
  "data_classification": "synthetic",
  "expected_intermediate": {},
  "expected_output": {
    "computed_facts": {
      "birthday": {
        "fact_id": "numerology.birthday",
        "master_number": false,
        "raw_total": 9,
        "reduction_steps": [
          9
        ],
        "rule_ids": [
          "NUMEROLOGY-CAL-DATE-001"
        ],
        "source_ids": [
          "SRC-NUMEROLOGY-PROJECT-SPEC-001"
        ],
        "value": 9
      },
      "date_trace": {
        "digits": [
          1,
          9,
          0,
          6,
          1,
          2,
          0,
          9
        ],
        "fact_id": "numerology.date_trace",
        "raw_total": 28,
        "rule_ids": [
          "NUMEROLOGY-CAL-TRACE-001",
          "NUMEROLOGY-CAL-DATE-001"
        ],
        "source_ids": [
          "SRC-NUMEROLOGY-PROJECT-SPEC-001"
        ]
      },
      "expression": {
        "fact_id": "numerology.expression",
        "master_number": false,
        "raw_total": 61,
        "reduction_steps": [
          61,
          7
        ],
        "rule_ids": [
          "NUMEROLOGY-CAL-NAME-001"
        ],
        "source_ids": [
          "SRC-NUMEROLOGY-PROJECT-SPEC-001"
        ],
        "value": 7
      },
      "life_path": {
        "fact_id": "numerology.life_path",
        "master_number": false,
        "raw_total": 28,
        "reduction_steps": [
          28,
          10,
          1
        ],
        "rule_ids": [
          "NUMEROLOGY-CAL-DATE-001"
        ],
        "source_ids": [
          "SRC-NUMEROLOGY-PROJECT-SPEC-001"
        ],
        "value": 1
      },
      "maturity": {
        "fact_id": "numerology.maturity",
        "master_number": false,
        "raw_total": 8,
        "reduction_steps": [
          8
        ],
        "rule_ids": [
          "NUMEROLOGY-CAL-DATE-001",
          "NUMEROLOGY-CAL-NAME-001"
        ],
        "source_ids": [
          "SRC-NUMEROLOGY-PROJECT-SPEC-001"
        ],
        "value": 8
      },
      "name_trace": {
        "fact_id": "numerology.name_trace",
        "letters": [
          {
            "category": "consonant",
            "letter": "G",
            "position": 1,
            "value": 7
          },
          {
            "category": "consonant",
            "letter": "R",
            "position": 2,
            "value": 9
          },
          {
            "category": "vowel",
            "letter": "A",
            "position": 3,
            "value": 1
          },
          {
            "category": "consonant",
            "letter": "C",
            "position": 4,
            "value": 3
          },
          {
            "category": "vowel",
            "letter": "E",
            "position": 5,
            "value": 5
          },
          {
            "category": "consonant",
            "letter": "R",
            "position": 6,
            "value": 9
          },
          {
            "category": "vowel",
            "letter": "I",
            "position": 7,
            "value": 9
          },
          {
            "category": "consonant",
            "letter": "V",
            "position": 8,
            "value": 4
          },
          {
            "category": "vowel",
            "letter": "E",
            "position": 9,
            "value": 5
          },
          {
            "category": "consonant",
            "letter": "R",
            "position": 10,
            "value": 9
          }
        ],
        "raw_total": 61,
        "rule_ids": [
          "NUMEROLOGY-CAL-TRACE-001"
        ],
        "source_ids": [
          "SRC-NUMEROLOGY-PROJECT-SPEC-001"
        ]
      },
      "personality": {
        "fact_id": "numerology.personality",
        "master_number": false,
        "raw_total": 41,
        "reduction_steps": [
          41,
          5
        ],
        "rule_ids": [
          "NUMEROLOGY-CAL-NAME-001"
        ],
        "source_ids": [
          "SRC-NUMEROLOGY-PROJECT-SPEC-001"
        ],
        "value": 5
      },
      "soul_urge": {
        "fact_id": "numerology.soul_urge",
        "master_number": false,
        "raw_total": 20,
        "reduction_steps": [
          20,
          2
        ],
        "rule_ids": [
          "NUMEROLOGY-CAL-NAME-001"
        ],
        "source_ids": [
          "SRC-NUMEROLOGY-PROJECT-SPEC-001"
        ],
        "value": 2
      }
    }
  },
  "forbidden_conclusions": [
    "The number proves a personality trait.",
    "A future event is guaranteed."
  ],
  "lineage": "pythagorean-project-v0.1",
  "must_match_rules": [
    "NUMEROLOGY-CAL-DATE-001",
    "NUMEROLOGY-CAL-NAME-001",
    "NUMEROLOGY-INTERPRET-THEME-001",
    "NUMEROLOGY-CAL-TRACE-001"
  ],
  "normalized_input": {
    "birth_date": "1906-12-09",
    "date_masters": [
      11,
      22,
      33
    ],
    "mapping": "pythagorean-a1-i9-repeat",
    "mapping_lineage": "pythagorean-project-v0.3",
    "masters": [
      11,
      22,
      33
    ],
    "name_letters": "GRACERIVER",
    "name_masters": [
      11,
      22,
      33
    ],
    "transliteration_policy": "latin_nfkd-v0.1",
    "transliteration_rule_ids": [
      "NUMEROLOGY-TRANSLITERATION-POLICY-001"
    ]
  },
  "raw_input": {
    "birth_date": "1906-12-09",
    "name": "Grace River"
  },
  "reviewers": [
    {
      "decision": "accepted",
      "notes": "Synthetic regression case; symbolic validity is not asserted.",
      "reviewed_at": "2026-07-23",
      "reviewer_id": "deterministic-profile-review",
      "role": "calculation"
    }
  ],
  "sources": [
    {
      "locator": "v0.1 mapping contract",
      "source_id": "SRC-NUMEROLOGY-PROJECT-SPEC-001"
    }
  ],
  "system": "numerology",
  "title": "Pythagorean project profile 002"
}
